{
  "$schema": "https://opensource.adobe.com/spectrum-design-data/schemas/v0/component.schema.json",
  "$id": "https://opensource.adobe.com/spectrum-design-data/schemas/v0/components/tooltip.json",
  "specVersion": "1.0.0-draft",
  "name": "tooltip",
  "displayName": "Tooltip",
  "description": "Tooltips show contextual help or information about specific components when a user hovers or focuses on them.",
  "meta": {
    "category": "feedback",
    "documentationUrl": "https://spectrum.adobe.com/page/tooltip/"
  },
  "options": {
    "label": {
      "type": "string"
    },
    "variant": {
      "type": "string",
      "enum": ["neutral", "informative", "negative"],
      "default": "neutral"
    },
    "hasIcon": {
      "type": "boolean",
      "description": "If the neutral variant, there is never an icon.",
      "default": false
    },
    "maxWidth": {
      "type": "number",
      "default": 160,
      "description": "units: pixels"
    },
    "placement": {
      "type": "string",
      "enum": ["top", "bottom", "left", "right"],
      "default": "top"
    },
    "shouldFlip": {
      "type": "boolean",
      "default": false
    },
    "offset": {
      "type": "number",
      "default": 4,
      "description": "units: pixels"
    },
    "containerPadding": {
      "type": "number",
      "default": 8,
      "description": "units: pixels"
    }
  },
  "lifecycle": {
    "introduced": "1.0.0-draft"
  },
  "tokenBindings": [
    {
      "token": "component-height-75",
      "context": "Minimum height"
    },
    {
      "token": "tooltip-maximum-width",
      "context": "Maximum width"
    },
    {
      "token": "corner-radius-500",
      "context": "Rounding"
    },
    {
      "token": "tooltip-tip-width",
      "context": "Tip"
    },
    {
      "token": "tooltip-tip-height",
      "context": "Tip"
    },
    {
      "token": "tooltip-tip-corner-radius",
      "context": "Rounding (tip)"
    },
    {
      "token": "component-edge-to-text-75",
      "context": "Spacing (start/end edges)"
    },
    {
      "token": "component-top-to-text-75",
      "context": "Spacing (top/bottom edge to text)"
    },
    {
      "token": "component-bottom-to-text-75",
      "context": "Spacing (top/bottom edge to text)"
    },
    {
      "token": "spacing-75",
      "context": "Spacing (tip to source)"
    },
    {
      "token": "spacing-100",
      "context": "Container padding"
    },
    {
      "token": "default-font-family",
      "context": "Label"
    },
    {
      "token": "regular-font-weight",
      "context": "Label"
    },
    {
      "token": "default-font-style",
      "context": "Label"
    },
    {
      "token": "font-size-75",
      "context": "Label"
    },
    {
      "token": "line-height-100",
      "context": "Label"
    },
    {
      "token": "cjk-line-height-100",
      "context": "Label"
    },
    {
      "token": "gray-25",
      "context": "Text"
    },
    {
      "token": "neutral-background-color-default",
      "context": "Background (Neutral)"
    },
    {
      "token": "informative-background-color-default",
      "context": "Background (Informative)"
    },
    {
      "token": "negative-background-color-default",
      "context": "Background (Negative)"
    }
  ],
  "accessibility": {
    "role": "tooltip",
    "focusable": false,
    "keyboardIntents": [],
    "wcag": [
      {
        "criterion": "1.4.13",
        "level": "AA",
        "title": "Content on Hover or Focus"
      },
      {
        "criterion": "4.1.2",
        "level": "A",
        "title": "Name, Role, Value"
      }
    ]
  }
}
