{
  "$schema": "https://opensource.adobe.com/spectrum-design-data/schemas/v0/component.schema.json",
  "$id": "https://opensource.adobe.com/spectrum-design-data/schemas/v0/components/avatar.json",
  "specVersion": "1.0.0-draft",
  "name": "avatar",
  "displayName": "Avatar",
  "description": "An avatar is a thumbnail representation of an entity, such as a user or an organization.",
  "meta": {
    "category": "navigation",
    "documentationUrl": "https://spectrum.adobe.com/page/avatar/"
  },
  "documentBlocks": [
    {
      "type": "purpose",
      "content": "An avatar is a thumbnail representation of an entity, such as a user or an organization."
    },
    {
      "type": "guideline",
      "content": "Keyboard focus.\n\nAn avatar can be navigated using a keyboard. The keyboard focus state adds a blue ring to the avatar in focus."
    },
    {
      "type": "guideline",
      "content": "Multiple avatars in a group.\n\nAn avatar group displays a set of related avatars together. It’s typically used to represent a collection of people or entities."
    },
    {
      "type": "guideline",
      "content": "Use gradient image avatars when a user image is undefined.\n\nUse branded generic avatars when a user has not set their avatar image. These images are designed to be abstracted from all genders, locales, and cultures."
    },
    {
      "type": "guideline",
      "content": "Use the initials avatar style for users with latin characters only.\n\nThe initials avatar is designed to work with latin characters only and supports 1 or 2 characters that are programmatically identified by the first name and last name in a user's account settings. For users with non-latin characters, their default avatar should be the gradient image style."
    },
    {
      "type": "guideline",
      "content": "Use the guest avatar style for users without an Adobe account.\n\nThe guest avatar style is designed for users who may be interacting with Adobe products, but are not logged in or do not have an Adobe account."
    }
  ],
  "implementations": [
    {
      "platform": "web",
      "componentName": "Avatar",
      "package": "@react-spectrum/s2"
    },
    {
      "platform": "web",
      "componentName": "Avatar",
      "importPath": "@adobe/spectrum-wc/components/avatar",
      "notes": "Spectrum 2 web component custom element: swc-avatar."
    }
  ],
  "options": {
    "size": {
      "type": "number",
      "default": 500,
      "values": [
        { "value": 50 },
        { "value": 75 },
        { "value": 100 },
        { "value": 200 },
        { "value": 300 },
        { "value": 400 },
        { "value": 500 },
        { "value": 600 },
        { "value": 700 },
        { "value": 800 },
        { "value": 900 },
        { "value": 1000 },
        { "value": 1100 },
        { "value": 1200 },
        { "value": 1300 },
        { "value": 1400 },
        { "value": 1500 }
      ]
    },
    "image": {
      "type": "string",
      "default": "user image",
      "values": [
        { "value": "user image" },
        { "value": "gradient image" },
        { "value": "gradient" },
        { "value": "guest image" },
        { "value": "initials" }
      ]
    },
    "isDisabled": { "type": "boolean", "default": false },
    "showStroke": { "type": "boolean", "default": false }
  },
  "states": [
    { "name": "down", "trigger": "interaction" },
    { "name": "keyboard-focus", "trigger": "interaction" },
    { "name": "disabled", "trigger": "prop" }
  ],
  "lifecycle": { "introduced": "1.0.0-draft" },
  "accessibility": { "focusable": false }
}
